{
  "format": "deployment-ops/cli/v1",
  "ok": false,
  "state": "unknown",
  "complete": false,
  "request_id": "724aa16e-f2aa-50d0-aee5-e01135f471b0",
  "location": "caller-session",
  "result": null,
  "problem": {
    "code": "ACCEPTANCE_UNKNOWN",
    "summary": "Resolve the original owner request; do not create another operation.",
    "retry": "same-request-after-reconcile",
    "owner": {
      "tool": "app-ops",
      "id": "58735bda-2152-5b96-9fcf-5a1ffd14872e",
      "epoch": "37de5c4a-33ee-55a5-adff-564fd3748ac8"
    },
    "resource": {
      "kind": "app",
      "id": "demo-app"
    },
    "evidence": []
  }
}
